eco_code,eco_num,forest_gdp,forest_partial_gdp,systemindex,cls_code,ecode_name,eco_id_u,eco_name,eco_notes,er_date_u,er_ration,er_update,realmmht,sourcedata,wwf_mhtnam,wwf_mhtnum,wwf_realm,wwf_realm2,datamask,first_b30,first_b40,first_b50,first_b70,TotalProtectedGainArea,last_b30,last_b40,last_b50,last_b70,loss,lossyear,treecover2000,TotalGainArea,TotalProtectedLossArea,TotalProtectedArea,TotalLossArea,TotalArea,forest_area_2012,forest_area_2012_net,protected_forest_area_2012,NetAreaLoss,dozer_rate_2000_2012_net,dozer_rate_2000_2012,UnprotectedForest2012,biome,plant_spcs,dozer_rate_2009_2015,forest_area_2015,protected_forest_area_2015,dozer_rate_2000_2018,forest_area_2018,protected_forest_area_2018,GDPperm2,GDPperm2_partial
IM0133,33,182520512,88718832,00000000000000000008,0,IM0133. Nicobar Islands rain forests,10232,Nicobar Islands Rain Forests,"","","","",IM1,"Olson, 2001",Tropical and Subtropical Moist Broadleaf Forests,1,IM,Indo-Malay,3749415.3,187041200,383172832,304973792,180242704,3749415.3,46178076,304058688,184789072,73811072,611590.88,1050064.6,129644960,4732663.5,21259718,468546720,58899024,1137698816,1078799744,1083532416,451036416,54166360,4513863.5,4908252,627763328,1,1379,448950.104911535,1183673690.5939,519099638.948599,3313029,1078064256,446914368,0.169303926908045,0.0822945677924415
IM0134,34,68171300864,2282663680,0000000000000000000a,0,IM0134. North Western Ghats moist deciduous forests,10233,North Western Ghats Moist Deciduous Forests,"","","","",IM1,"Olson, 2001",Tropical and Subtropical Moist Broadleaf Forests,1,IM,Indo-Malay,649233.06,15336673,46847804,48845672,27129060,649233.06,9951264,48539532,37748860,18771358,73325.125,488808.41,10779474,619863.5,2641743.3,719200704,27285300,4367441920,4340156416,4340776448,717208192,26665436,2222119.8,2273775,3622948352,1,2300,6590173.9207261,25985004121.0055,1811800608.06966,2400697.3,4324229120,715379712,15.7649604061683,0.527877597753192
IM0135,35,23758974976,2759369728,0000000000000000000c,0,IM0135. North Western Ghats montane rain forests,10234,North Western Ghats Montane Rain Forests,"","","","",IM1,"Olson, 2001",Tropical and Subtropical Moist Broadleaf Forests,1,IM,Indo-Malay,1705428.8,43560640,119070472,125272136,70710616,1705428.8,29176874,122082352,98751744,49552964,309153.09,1987161.9,36852116,4528509,10812014,2007374848,92271960,9200035840,9107764224,9112292352,1998268288,87743448,7311954,7689330,7109495808,1,2800,11207248.7852086,26131825092.5505,4401217262.46229,7835665,9058994176,1993213952,2.62269458555837,0.304600011258468
IM0136,36,4182971136,1199660288,0000000000000000000e,0,IM0136. Northern Annamites rain forests,10235,Northern Annamites Rain Forests,"","","","",IM1,"Olson, 2001",Tropical and Subtropical Moist Broadleaf Forests,1,IM,Indo-Malay,98795944,1694140544,8202342400,6909669888,3234317312,98795944,1188586240,7976668160,6159055872,2642202368,43417856,225969904,5616307200,397196128,243641696,12939910144,1887209088,35523723264,33636513792,34033711104,12795064320,1490012928,124167744,157267424,20841449472,1,3000,129068398.284153,43867717963.0462,15510020196.1671,245998304,31095754752,12421906432,0.134519041887252,0.0385795520182008
IM0137,37,131636895744,22650130432,00000000000000000010,0,IM0137. Northern Indochina subtropical forests,10236,Northern Indochina Subtropical Forests,"","","","",IM1,"Olson, 2001",Tropical and Subtropical Moist Broadleaf Forests,1,IM,Indo-Malay,362340096,6351019520,31140919296,27080880128,12728074240,362340096,4568038912,29607041024,21710944256,9135671296,92348456,562033344,16503932928,1929071104,619662912,19334537216,11120547840,220985311232,209864769536,211793838080,19077214208,9191477248,765956416,926712320,190787551232,1,7000,2262227918.80995,365572471917.484,25979714088.6556,1438578816,195090890752,18358202368,0.674746500139451,0.116100399894083
IM0138,38,6266095616,425130144,00000000000000000012,0,IM0138. Northern Khorat Plateau moist deciduous forests,10237,Northern Khorat Plateau Moist Deciduous Forests,"","","","",IM1,"Olson, 2001",Tropical and Subtropical Moist Broadleaf Forests,1,IM,Indo-Malay,8351032.5,227172480,673635648,698200064,361155776,8351032.5,124898368,663176960,561591808,244134768,496954.44,2729321.3,75562664,135204528,7353727,430477760,652789184,3068830208,2416040960,2551245568,431475072,517584640,43132052,54399100,1984565888,1,1500,48293107.919387,8894462932.68063,858037985.792269,52346100,2126600448,419695136,2.94653169188084,0.199910681105998
IM0139,39,8966704128,1392291200,00000000000000000014,0,IM0139. Northern Thailand-Laos moist deciduous forests,10238,Northern Thailand-Laos Moist Deciduous Forests,"","","","",IM1,"Olson, 2001",Tropical and Subtropical Moist Broadleaf Forests,1,IM,Indo-Malay,18226378,443476320,1504073728,1487405312,754026112,18226378,261947360,1459939328,1173470976,525030752,1205573.9,6838027,251614672,96426328,84567304,6595648512,1001345600,23991773184,22990428160,23086854144,6529307648,904919296,75409944,83445464,16461120512,1,2300,135935624.586263,35908977377.3762,9600892466.98054,128300216,21682368512,6486385152,0.413548184232614,0.0642130586070172
IM0140,40,1476457856,649476544,00000000000000000016,0,IM0140. Northern Triangle subtropical forests,10239,Northern Triangle Subtropical Forests,"","","","",IM1,"Olson, 2001",Tropical and Subtropical Moist Broadleaf Forests,1,IM,Indo-Malay,69924128,948217472,5910351872,4554977280,1911176320,69924128,853916096,5829404160,4336663040,1749428608,37536432,273039072,4955807744,260235392,207842256,16654866432,1098358784,46317993984,45219635200,45479870464,16516947968,838123392,69843616,91529896,28702687232,1,3500,19341796.0298512,53076706947.951,18649574188.2851,120853288,44142632960,16568196096,0.0334474352116218,0.014713135589092
IM0141,41,22543947776,1137369472,00000000000000000018,0,IM0141. Northern Vietnam lowland rain forests,10240,Northern Vietnam Lowland Rain Forests,"","","","",IM1,"Olson, 2001",Tropical and Subtropical Moist Broadleaf Forests,1,IM,Indo-Malay,93623320,1880578304,8119510016,7276650496,3467006208,93623320,1358977280,7496846336,5004333568,2083549440,10411123,75137176,2370421760,223976176,45792808,1691605632,607663232,6353468928,5745805824,5969781760,1739436160,383687040,31973920,50638604,4006369792,1,2800,37984045.4306468,12528527094.4806,3362258332.81767,98561048,4579369984,1794386816,4.92293652942806,0.248368110891649
IM0142,42,12238279680,164403120,0000000000000000001a,0,IM0142. Orissa semi-evergreen forests,10241,Orissa Semi-Evergreen Forests,"","","","",IM1,"Olson, 2001",Tropical and Subtropical Moist Broadleaf Forests,1,IM,Indo-Malay,0,0,0,0,0,0,0,0,0,0,0,0,0,3416.4492,9527.166,3356023.5,4871102.5,437830752,432959648,432963072,3346496.3,4867686,405640.5,405925.22,429613152,1,1400,4539604.94316598,4279809509.245,82951930.463063,358699.34,431374176,3340924.8,28.3704504369775,0.3811148862096
IM0143,43,6641980928,3081127168,0000000000000000001b,0,IM0143. Palawan rain forests,10242,Palawan Rain Forests,"","","","",IM1,"Olson, 2001",Tropical and Subtropical Moist Broadleaf Forests,1,IM,Indo-Malay,219732400,3143655936,21249456128,15112757248,6227029504,219732400,2619666176,20428320768,13570251776,5368386048,72533312,444699456,11959498752,146520144,478717856,8497114112,560769472,10083922944,9523153920,9669673984,8238128640,414249344,34520780,46730788,1285025280,1,2700,3474217.09534952,12635536801.3543,10627300737.3939,66490468,8887094272,7461887488,0.747373744973817,0.346696802542931
IM0144,44,3405075712,1934989312,0000000000000000001c,0,IM0144. Peninsular Malaysian montane rain forests,10243,Peninsular Malaysian Montane Rain Forests,"","","","",IM1,"Olson, 2001",Tropical and Subtropical Moist Broadleaf Forests,1,IM,Indo-Malay,8540140,127898152,720011456,559778368,237599760,8540140,86402816,770112256,533011456,207775264,4297245,27109538,539082240,57495192,67551248,5067775488,382830880,15907872768,15525042176,15582536704,5008764416,325335680,27111306,31902574,10516277248,1,3200,2436064.41375613,16973057402.7642,5358042725.13003,40669184,15175827456,4941801472,0.224374962213593,0.127504699009672
IM0145,45,2601498624,1343620480,0000000000000000001d,0,IM0145. Peninsular Malaysian peat swamp forests,10244,Peninsular Malaysian Peat Swamp Forests,"","","","",IM1,"Olson, 2001",Tropical and Subtropical Moist Broadleaf Forests,1,IM,Indo-Malay,463277.47,4945884.5,37190540,29226744,12615500,463277.47,4391927.5,40183000,27269458,9972050,319626.53,533764.63,32145186,188496080,980929.25,26071124,719605184,2963868672,2244263424,2432759552,25553472,531109120,44259092,59967100,2218710016,1,1100,26018573.9844222,3245604940.49976,27551218.6972082,63567408,1819655296,24892270,1.42966562387869,0.738392860974038
IM0146,46,1022710251520,203335516160,0000000000000000001e,0,IM0146. Peninsular Malaysian rain forests,10245,Peninsular Malaysian Rain Forests,"","","","",IM1,"Olson, 2001",Tropical and Subtropical Moist Broadleaf Forests,1,IM,Indo-Malay,172658624,3092150016,14959361024,12572782592,5558373376,172658624,1696030464,15354208256,10585979904,3986966016,69647016,276204352,8222755840,5689784320,359546432,10003737600,17911642112,91136589824,73224945664,78914732032,9816849408,12221857792,1018488128,1492636800,63408095232,1,7000,273524171.865682,109738550402.472,10627200519.7857,1655125888,61344325632,9324969984,16.6716357378376,3.31465892020388
IM0147,47,35433873408,587240448,0000000000000000001f,0,IM0147. Red River freshwater swamp forests,10246,Red River Freshwater Swamp Forests,"","","","",IM1,"Olson, 2001",Tropical and Subtropical Moist Broadleaf Forests,1,IM,Indo-Malay,1657929.5,36806308,128492960,124594104,64267404,1657929.5,22432072,131251880,94001520,42393096,121976.8,669206.69,29325786,8667925,1196525.3,30068846,11479081,212078224,200599136,209267072,30530250,2811156,234263,956590.06,170068880,1,800,8951009.53972439,1687525545.4524,57200664.8430798,2133158.3,173681376,28437770,204.016540080843,3.38113654742118
IM0148,48,0,0,00000000000000000020,0,IM0148. South China Sea Islands,10247,South China Sea Islands,"","","","",IM1,"Olson, 2001",Tropical and Subtropical Moist Broadleaf Forests,1,IM,Indo-Malay,0,0,0,0,0,0,0,0,0,0,0,0,0,0,0,0,0,0,0,0,0,0,0,0,0,1,400,0,241213.864855239,0,0,0,0,,
IM0149,49,1005714210816,110276788224,00000000000000000021,0,IM0149. South China-Vietnam subtropical evergreen forests,10248,South China-Vietnam Subtropical Evergreen Forests,"","","","",IM1,"Olson, 2001",Tropical and Subtropical Moist Broadleaf Forests,1,IM,Indo-Malay,20810560,452393248,1664280960,1628016768,849102848,20810560,298783552,1640057088,1200185088,537662656,1985107.3,12002432,454764192,1693916672,23834168,1689168128,7224315904,64476803072,57252487168,58946404352,1686144512,5530399232,460866592,602026304,55566344192,1,6500,1369606768.22749,127779571109.487,2446315968.9046,689597696,52064043008,1702775808,19.3168673178429,2.11809882315623
IM0150,50,41435435008,10407455744,00000000000000000023,0,IM0150. South Western Ghats moist deciduous forests,10250,South Western Ghats Moist Deciduous Forests,"","","","",IM1,"Olson, 2001",Tropical and Subtropical Moist Broadleaf Forests,1,IM,Indo-Malay,16127265,328348864,1249588480,1165511296,596888704,16127265,188787536,1235141120,859015104,364208160,1918496.3,9839268,482640512,16715170,14319993,2852554496,68330664,7500723712,7432393216,7449107968,2854361856,51615496,4301291.5,5694222,4578031616,1,2300,82420503.4717837,16172367159.8187,5301728684.24451,8568110,7346497536,2826387456,5.64016183289441,1.41665544608167
IM0151,51,44536496128,13932435456,00000000000000000024,0,IM0151. South Western Ghats montane rain forests,10251,South Western Ghats Montane Rain Forests,"","","","",IM1,"Olson, 2001",Tropical and Subtropical Moist Broadleaf Forests,1,IM,Indo-Malay,11018205,220545056,861879360,811138816,438164736,11018205,124658560,869989632,641802816,285713792,1465472.5,7521522,378036576,27186534,20464108,3779621376,132757856,13169996800,13037239296,13064425472,3770175488,105571320,8797610,11063155,9267063808,1,3300,31833728.5953929,21073469803.6578,5025641364.26208,13564728,12925832192,3748674816,3.44554187819058,1.07787531580543
IM0152,52,8645470208,2330104320,00000000000000000025,0,IM0152. Southern Annamites montane rain forests,10252,Southern Annamites Montane Rain Forests,"","","","",IM1,"Olson, 2001",Tropical and Subtropical Moist Broadleaf Forests,1,IM,Indo-Malay,92280976,1484387584,7465445888,6234647040,2894895872,92280976,977385536,7654277120,5453229056,2187452672,35917484,183567856,4903283712,340315616,288811680,9139625984,2222652416,35183017984,32960364544,33300680704,8943094784,1882336768,156861392,185221040,24017268736,1,4000,70567796.4582133,44505947523.5019,12417526312.1574,231369744,31018362880,9927940096,0.278721035067083,0.0751201579855913
IM0153,53,24314324992,7196668416,00000000000000000026,0,IM0153. Southwest Borneo freshwater swamp forests,10253,Southwest Borneo Freshwater Swamp Forests,"","","","",IM1,"Olson, 2001",Tropical and Subtropical Moist Broadleaf Forests,1,IM,Indo-Malay,97387048,1383782656,7234529792,5518311424,2373920768,97387048,931620352,7615847424,4614051840,1641524096,48534096,280262560,6055711232,513125152,344981888,4155060736,3889847296,24388339712,20498493440,21011617792,3907465984,3376722176,281393504,324153952,16591027200,1,1400,215425816.700806,28173245562.3301,4515824144.17722,432781184,16598278144,3391533568,1.46487031853899,0.43357921548034
IM0154,54,127342403584,55133216768,00000000000000000027,0,IM0154. Sri Lanka lowland rain forests,10254,Sri Lanka Lowland Rain Forests,"","","","",IM1,"Olson, 2001",Tropical and Subtropical Moist Broadleaf Forests,1,IM,Indo-Malay,5043024,92302440,405974720,354485952,168020592,5043024,54925024,423382496,301913984,122539992,633877.63,3350355.5,192091824,35723412,9252349,1322350464,147546112,8609320960,8461774848,8497498112,1318141184,111822704,9318559,12295509,7143633920,1,2000,48802683.7198906,11711365513.7483,1589641248.4603,16433223,8313523200,1307637504,15.3175014395822,6.63175111702341
IM0155,55,9928658944,5364140544,00000000000000000028,0,IM0155. Sri Lanka montane rain forests,10255,Sri Lanka Montane Rain Forests,"","","","",IM1,"Olson, 2001",Tropical and Subtropical Moist Broadleaf Forests,1,IM,Indo-Malay,11151307,154743232,790342912,689997248,355423552,11151307,88804824,892858432,555544320,224106480,5678576,27412720,679948480,24344340,11595785,705926720,48685796,1986704768,1938018944,1962363264,705482240,24341456,2028454.6,4057149.8,1232536704,1,2200,19635668.2354237,2863960765.29185,843107364.780403,3568396.8,1922473600,702407424,5.16452290632236,2.79022845567294
IM0156,56,2919875328,1810661376,00000000000000000029,0,IM0156. Sulu Archipelago rain forests,10256,Sulu Archipelago Rain Forests,"","","","",IM1,"Olson, 2001",Tropical and Subtropical Moist Broadleaf Forests,1,IM,Indo-Malay,889.19751,7113.5801,96033.328,49795.063,17783.949,889.19751,9781.1729,87141.359,54241.047,21340.74,0,0,80027.773,20957166,12528.71,1958323.3,70761896,1707038464,1636276608,1657233792,1946683.8,49804728,4150394,5896824.5,1634329984,1,1400,1275381.9047558,1997045828.89048,2105867.66025582,7333965.5,1575027072,1938539.8,1.85385723198541,1.14960651038257
IM0157,57,63726837760,16036415488,0000000000000000002b,0,IM0157. Sumatran freshwater swamp forests,10257,Sumatran Freshwater Swamp Forests,"","","","",IM1,"Olson, 2001",Tropical and Subtropical Moist Broadleaf Forests,1,IM,Indo-Malay,82767904,1672917632,6823683072,6488047104,3060905984,82767904,838640832,7065927168,4912858624,1827811200,13094775,63256904,1818107648,1250340224,49393336,386266304,3386713856,10120870912,6734156800,7984497152,419640864,2136373632,178031136,282226144,6314515968,1,1600,104085641.659351,14367491595.3889,594104250.924606,265343088,5344695296,304796640,11.9233808908982,3.00043587143345
IM0158,58,327663779840,118248939520,0000000000000000002d,0,IM0158. Sumatran lowland rain forests,10258,Sumatran Lowland Rain Forests,"","","","",IM1,"Olson, 2001",Tropical and Subtropical Moist Broadleaf Forests,1,IM,Indo-Malay,312304928,4523001344,25377777664,20671787008,9138160640,312304928,2972575488,27164870656,18783424512,7064418304,166339968,806281984,18860677120,11130670080,1246110208,16422297600,38695202816,183242031104,144546824192,155677491200,15488492544,27564531712,2297044224,3224600320,129058332672,1,7500,266193218.101883,237020017160.758,17644315017.3235,3192144896,125783425024,14443784192,2.60498376298372,0.940099536146655
IM0159,59,44450713600,18670096384,0000000000000000002f,0,IM0159. Sumatran montane rain forests,10259,Sumatran Montane Rain Forests,"","","","",IM1,"Olson, 2001",Tropical and Subtropical Moist Broadleaf Forests,1,IM,Indo-Malay,75550952,1109474048,6193468416,5335516160,2560283648,75550952,709854144,6663393792,4662255104,1841615488,24857048,121585016,3996804096,324073088,246864384,21445705728,1725281152,59727708160,58002427904,58326499328,21274392576,1401208064,116767336,143773424,36728037376,1,3500,24683827.0622,69141550898.2739,23029889047.6969,190582944,56297213952,20839438336,0.789572173818397,0.331634464183582
IM0160,60,72463335424,24492517376,00000000000000000030,0,IM0160. Sumatran peat swamp forests,10260,Sumatran Peat Swamp Forests,"","","","",IM1,"Olson, 2001",Tropical and Subtropical Moist Broadleaf Forests,1,IM,Indo-Malay,64674028,1004101120,5189900288,4192206336,1844387584,64674028,610531648,5244944384,3292673792,1185160832,20821520,118485640,3340245248,7580503552,207567648,5516327936,22368327680,62696611840,40328282112,47908786176,5373434368,14787823616,1232318592,1864027264,34954846208,1,2000,532771463.985879,74245455498.6037,6125915077.546,1727654784,31598825472,4838167552,2.29322876219594,0.775108473500163
IM0161,61,89573810176,21651091456,00000000000000000031,0,IM0161. Sundaland heath forests,10261,Sundaland Heath Forests,"","","","",IM1,"Olson, 2001",Tropical and Subtropical Moist Broadleaf Forests,1,IM,Indo-Malay,221981232,2988230656,16917285888,12416363520,5141578240,221981232,2143555072,17386418176,10974744576,3955668224,131475080,485906400,15095982080,3024812800,505260032,6498379264,12356646912,58006781952,45650132992,48674947072,6215100416,9331833856,777652800,1029720576,39435034624,1,1600,195528877.198093,69666973129.8794,7110097588.88044,1115948032,37919719424,5482885632,2.36219601665373,0.570971826397446
IM0162,62,100860895232,2823513856,00000000000000000032,0,IM0162. Sundarbans freshwater swamp forests,10262,Sundarbans Freshwater Swamp Forests,"","","","",IM1,"Olson, 2001",Tropical and Subtropical Moist Broadleaf Forests,1,IM,Indo-Malay,0,0,0,0,0,0,0,0,0,0,0,0,0,0,403.56482,795788.63,413745.13,356364992,355951232,355951232,795385.06,413745.13,34478.762,34478.762,355155840,1,800,67917640.9038737,2438023199.81061,18281492.77464,24567.729,355922784,794285.88,283.378585935089,7.93293934225913
IM0163,63,77796343808,22912598016,000000000000000001ad,0,IM0163. Tenasserim-South Thailand semi-evergreen rain forests,10264,Tenasserim-South Thailand Semi-Evergreen Rain Forests,"","","","",IM1,"Olson, 2001",Tropical and Subtropical Moist Broadleaf Forests,1,IM,Indo-Malay,123117592,2093231872,11037337600,9332410368,4165099264,123117592,1358269056,10904444928,7891194368,3150376192,28042220,151784928,4884764160,805632192,453177024,17776941056,5292070912,66519818240,61227745280,62033379328,17446881280,4486438912,373869920,441005920,43780866048,1,4000,40446297.019253,90539063183.9887,20794173259.0511,581144064,56059224064,17398325248,1.38775277587117,0.408721283581126
IM0164,64,39527337984,2185360128,000000000000000001ae,0,IM0164. Tonle Sap freshwater swamp forests,10265,Tonle Sap Freshwater Swamp Forests,"","","","",IM1,"Olson, 2001",Tropical and Subtropical Moist Broadleaf Forests,1,IM,Indo-Malay,10986974,199529648,794682752,738984384,346466944,10986974,124188520,807920064,610524096,237648080,2022500.3,11380721,403436640,10047701,118222216,2063581312,334057088,5311174144,4977117184,4987164672,1956346112,324009376,27000782,27838090,3020771072,1,800,70635974.7714033,8652816971.86642,2463360093.72487,19820644,4954402816,1941376768,7.97822451100431,0.44109455955872
IM0165,65,21708926976,1362227712,000000000000000001af,0,IM0165. Tonle Sap-Mekong peat swamp forests,10266,Tonle Sap-Mekong Peat Swamp Forests,"","","","",IM1,"Olson, 2001",Tropical and Subtropical Moist Broadleaf Forests,1,IM,Indo-Malay,1537438,27157984,118860000,83009368,38759880,1537438,17079346,116909872,71562184,29405794,329968.63,1569323.1,66107332,4156700.8,15134029,292516192,108817984,1798133120,1689315072,1693471872,278919616,104661280,8721773,9068165,1410395392,1,700,144074684.104007,2794679841.3118,564046773.303309,11977014,1582546816,253238896,13.7177154928477,0.860781935944952
IM0166,66,301133004800,4915354624,000000000000000001b0,0,IM0166. Upper Gangetic Plains moist deciduous forests,10267,Upper Gangetic Plains Moist Deciduous Forests,"","","","",IM1,"Olson, 2001",Tropical and Subtropical Moist Broadleaf Forests,1,IM,Indo-Malay,1123126.1,30248834,73195048,73318104,42786388,1123126.1,22093128,78241376,63901928,31585756,59746.586,490592.31,10143342,559193.5,1755861.4,572987392,25816008,3538578944,3512762880,3513322240,572354688,25256814,2104734.5,2151334,2940408320,1,2100,9665325.29122338,10143016770.1158,1322069822.17201,1692510,3508113664,571395200,85.8390102607576,1.40113892957375
IM0167,67,173601226752,42457337856,000000000000000001b1,0,IM0167. Western Java montane rain forests,10268,Western Java Montane Rain Forests,"","","","",IM1,"Olson, 2001",Tropical and Subtropical Moist Broadleaf Forests,1,IM,Indo-Malay,10569527,188797264,814977280,713550400,371591072,10569527,96428456,844087040,571412736,234192016,1219557.1,3018857.5,402944416,70900624,20431478,1745702400,218859040,15427204096,15208344576,15279245312,1735840512,147958416,12329868,18238254,13472503808,1,2000,51909418.6020036,22504617241.4567,1992478535.30683,18627572,15091907584,1720522624,11.5029346545991,2.81325191130988
IM0168,68,654487126016,65500983296,000000000000000001b2,0,IM0168. Western Java rain forests,10269,Western Java Rain Forests,"","","","",IM1,"Olson, 2001",Tropical and Subtropical Moist Broadleaf Forests,1,IM,Indo-Malay,3471022.8,58673612,293033152,238604608,114347440,3471022.8,36946204,305200448,205457008,81370576,540060.94,1230885.8,154563488,111210584,5658567,697179456,513158720,14409203712,13896044544,14007256064,694991936,401948128,33495678,42763228,13201052672,1,3500,50465068.3156888,22679743092.3071,791998916.433325,43928552,13618489344,689226304,48.0587170488445,4.80970992020185
IM0169,69,16863657984,4613478912,000000000000000001d3,0,IM0169. Hainan Island monsoon rain forests,10212,Hainan Island Monsoon Rain Forests,"","","","",IM1,"Olson, 2001",Tropical and Subtropical Moist Broadleaf Forests,1,IM,Indo-Malay,0,0,0,0,0,0,0,0,0,0,0,0,0,105627400,0,0,729184640,8572559872,7843375104,7949002752,0,623557248,51963104,60765388,7843375104,1,3000,181121393.82173,12172990000.8629,0,69594664,7319856128,0,2.30382369395116,0.630269069681912
IM0170,70,24585033728,2910699008,00000000000000000006,0,IM0170. Nansei Islands subtropical evergreen forests,10231,Nansei Islands Subtropical Evergreen Forests,"","","","",IM1,"Olson, 2001",Tropical and Subtropical Moist Broadleaf Forests,1,IM,Indo-Malay,3940845,75473120,324293312,243176096,121955192,3940845,42869444,315963072,191921856,82587312,1341488.4,7600238.5,184252960,12186116,8058196,575741504,58449900,2232470784,2174020864,2186206976,571624128,46263784,3855315.3,4870825,1602396672,1,2000,9481584.44396223,2796420119.22382,687581162.007453,4025970.3,2160003328,602704000,11.3819425226367,1.34754376082147
IM0171,71,22158067712,2053733632,00000000000000000022,0,IM0171. South Taiwan monsoon rain forests,10249,South Taiwan Monsoon Rain Forests,"","","","",IM1,"Olson, 2001",Tropical and Subtropical Moist Broadleaf Forests,1,IM,Indo-Malay,1100164.8,21849190,91385768,78840464,37521356,1100164.8,12320948,90480728,62590412,25866384,205898.08,861710.44,36691040,6837780.5,7670175,258219520,36835336,1346495488,1309660160,1316497920,251649504,29997556,2499796.3,3069611.3,1058010624,1,2700,2109673.26776131,1709796548.35503,305556837.840878,2610647,1299503872,249597184,17.0511748286657,1.58039823985996
IM0172,72,550483787776,59959730176,00000000000000000033,0,IM0172. Taiwan subtropical evergreen forests,10263,Taiwan Subtropical Evergreen Forests,"","","","",IM1,"Olson, 2001",Tropical and Subtropical Moist Broadleaf Forests,1,IM,Indo-Malay,3590827,76475488,282932064,283049152,149537008,3590827,35241336,283612896,217940160,99258960,114097.7,484605.13,77927984,11040899,48398496,5673576448,184193936,18826125312,18641932288,18652973056,5628768768,173153040,14429420,15349495,13013164032,1,3000,23258620.6149966,24470160039.3004,6576906374.28207,14496588,18565187584,5632793600,29.6513991730642,3.22968620191454
IM0201,1,121039781888,1633815296,000000000000000001b3,0,IM0201. Central Deccan Plateau dry deciduous forests,10270,Central Deccan Plateau Dry Deciduous Forests,"","","","",IM2,"Olson, 2001",Tropical and Subtropical Dry Broadleaf Forests,2,IM,Indo-Malay,86590.078,2221745.8,5836616.5,6122264,3791999.3,86590.078,1290228,5476621.5,4448396.5,2440999.3,9266.0859,19365.434,1438904.4,355364.28,613230.88,491212224,78776544,5616998912,5538222592,5538577920,490685568,78421176,6535098,6564712,5047537152,2,1800,40024347.9866026,34748370671.5017,3608334953.14664,5139084.5,5524495360,490824224,21.9096540046691,0.295740187932749
