eco_code,eco_num,forest_gdp,forest_partial_gdp,systemindex,cls_code,ecode_name,eco_id_u,eco_name,eco_notes,er_date_u,er_ration,er_update,realmmht,sourcedata,wwf_mhtnam,wwf_mhtnum,wwf_realm,wwf_realm2,datamask,first_b30,first_b40,first_b50,first_b70,TotalProtectedGainArea,last_b30,last_b40,last_b50,last_b70,loss,lossyear,treecover2000,TotalGainArea,TotalProtectedLossArea,TotalProtectedArea,TotalLossArea,TotalArea,forest_area_2012,forest_area_2012_net,protected_forest_area_2012,NetAreaLoss,dozer_rate_2000_2012_net,dozer_rate_2000_2012,UnprotectedForest2012,biome,plant_spcs,dozer_rate_2009_2015,forest_area_2015,protected_forest_area_2015,dozer_rate_2000_2018,forest_area_2018,protected_forest_area_2018,GDPperm2,GDPperm2_partial
AA0101,1,71515832,50484556,000000000000000000f4,0,AA0101. Admiralty Islands lowland rain forests,10000,Admiralty Islands Lowland Rain Forests,"","","","",AA1,"Olson, 2001",Tropical and Subtropical Moist Broadleaf Forests,1,AA,Australasia,154560.09,2209407.3,16218984,11166748,4560866,154560.09,1056011.5,13327909,7958508.5,2890185.8,13401.133,89340.82,7724418.5,5758028,1108015.5,29517778,44497944,1865459200,1820961280,1826719232,28564322,38739916,3228326.3,3708162,1792396928,1,2000,65759.882306347,2001216181.51971,32285012.8470971,3835783,1796415104,28093818,0.0398103043337583,0.02810294563188
AA0102,2,518036224,145399952,000000000000000000f7,0,AA0102. Banda Sea Islands moist deciduous forests,10001,Banda Sea Islands Moist Deciduous Forests,"","","","",AA1,"Olson, 2001",Tropical and Subtropical Moist Broadleaf Forests,1,AA,Australasia,3243240.3,44957780,291934144,210325072,90922320,3243240.3,32221490,299387488,187328064,71064384,1070128.5,4464208,184391264,38831144,9180057,905882816,212132656,5308434432,5096301568,5135132672,899945984,173301504,14441792,17677722,4196355584,1,1200,1212786.60109209,6435802164.85343,1047310182.27437,19151738,4963703296,953633216,0.104364864922015,0.0292926356249316
AA0103,3,1854590080,703762432,000000000000000000f9,0,AA0103. Biak-Numfoor rain forests,10002,Biak-Numfoor Rain Forests,"","","","",AA1,"Olson, 2001",Tropical and Subtropical Moist Broadleaf Forests,1,AA,Australasia,727399.63,8747161,71882632,50218308,20171874,727399.63,6321535.5,69031408,42302688,15243418,101462.09,587307.81,48426508,18639200,1413150,427980736,69972816,2357106944,2287134208,2305773312,427294976,51333616,4277801.5,5831068,1859839232,1,1500,577671.295910565,2504919497.70542,464649892.467303,6143243,2246528512,444311328,0.825535963640599,0.313266637053926
AA0104,4,268074064,121310136,000000000000000000fa,0,AA0104. Buru rain forests,10003,Buru Rain Forests,"","","","",AA1,"Olson, 2001",Tropical and Subtropical Moist Broadleaf Forests,1,AA,Australasia,190974,3085033.5,15794622,12783672,5509696,190974,1999876.9,17160892,11056870,4238022.5,20524.775,67821.953,7991422.5,24082390,696708.88,61570804,148446064,6665759744,6517313536,6541395968,61065068,124363672,10363639,12370505,6456248320,1,1700,503840.898828125,7880007277.99326,68442892.9871018,19897084,6307612160,60234684,0.0425000867523218,0.0192323391043751
AA0105,5,35982798848,20863203328,000000000000000000fc,0,AA0105. Central Range montane rain forests,10004,Central Range Montane Rain Forests,"","","","",AA1,"Olson, 2001",Tropical and Subtropical Moist Broadleaf Forests,1,AA,Australasia,38745104,487597120,3363119616,2467240192,1011263680,38745104,368200704,3432608000,2301670400,859591552,17453476,89177344,2639743232,210099456,133021152,22247526400,1038887872,150960619520,149921726464,150131834880,22153250816,828788416,69065704,86573992,127768477696,1,7500,20089531.0155363,166254401943.479,24072323154.6175,142951088,148387495936,21947758592,0.242492122540564,0.140599470301718
AA0106,6,1876956160,1082941312,000000000000000000fe,0,AA0106. Halmahera rain forests,10005,Halmahera Rain Forests,"","","","",AA1,"Olson, 2001",Tropical and Subtropical Moist Broadleaf Forests,1,AA,Australasia,4329005,55019944,341360736,247184448,100910496,4329005,43265796,366182816,232290752,86811112,2118272,8322014,289155744,190471088,15950796,1961559296,839007680,23539363840,22700355584,22890827776,1949937536,648536576,54044716,69917304,20750417920,1,2000,2936738.18842295,24850573988.4646,2043922380.25785,96832400,21796380672,1932289664,0.0861132032994436,0.0496844557955058
AA0107,7,575679552,314575104,00000000000000000100,0,AA0107. Huon Peninsula montane rain forests,10006,Huon Peninsula Montane Rain Forests,"","","","",AA1,"Olson, 2001",Tropical and Subtropical Moist Broadleaf Forests,1,AA,Australasia,1363649.5,20746084,114728336,89097960,38313164,1363649.5,16368911,125010240,84739688,32514316,552809,3042048,74587760,34551332,4802227,487056544,228498288,13910456320,13681957888,13716509696,483617952,193946960,16162247,19041524,13198340096,1,5500,615841.668219593,15668076051.6817,549713380.68882,22510178,13505272832,479811616,0.0426262807987084,0.0232927618651755
AA0108,8,1548089216,1000918080,000000000000000001b4,0,AA0108. Japen rain forests,17000,Japen Rain Forests,"","","","",AA1,"Olson, 2001",Tropical and Subtropical Moist Broadleaf Forests,1,AA,Australasia,721092.06,10436645,70615152,49276420,20484572,721092.06,6463914.5,63736640,40029976,15062510,164412.75,1095493.4,43559432,3916962.3,9052455,1087425152,26471454,2229522432,2203051008,2206968064,1079093760,22554492,1879541,2205954.5,1123957248,1,1500,253935.230529386,2283239804.42724,1124786803.0097,2282901,2188430336,1076200192,0.707397073844986,0.457368033852735
AA0109,9,0,0,00000000000000000102,0,AA0109. Lord Howe Island subtropical forests,10007,Lord Howe Island Subtropical Forests,"","","","",AA1,"Olson, 2001",Tropical and Subtropical Moist Broadleaf Forests,1,AA,Australasia,0,0,0,0,0,0,0,0,0,0,0,0,0,0,0,0,0,0,0,0,0,0,0,0,0,1,210,0,7710780.99943129,7710780.99943129,0,0,0,,
AA0110,10,66513752,42088740,00000000000000000104,0,AA0110. Louisiade Archipelago rain forests,10008,Louisiade Archipelago Rain Forests,"","","","",AA1,"Olson, 2001",Tropical and Subtropical Moist Broadleaf Forests,1,AA,Australasia,0,0,0,0,0,0,0,0,0,0,0,0,0,3513954,0,0,23455662,1231597312,1208141696,1211655552,0,19941708,1661809,1954638.5,1208141696,1,3200,59838.1578048407,1330407413.33371,0,2258788.5,1190939136,0,0.0558498331185919,0.0353407984738525
AA0111,11,1608898176,1054353984,00000000000000000106,0,AA0111. New Britain-New Ireland lowland rain forests,10009,New Britain-New Ireland Lowland Rain Forests,"","","","",AA1,"Olson, 2001",Tropical and Subtropical Moist Broadleaf Forests,1,AA,Australasia,11913948,142396544,1196857600,802789888,310201504,11913948,113073936,1149673856,700480320,254071552,2890336.3,14751259,749504000,442480480,34636728,810170752,1374788096,31837181952,30462394368,30904875008,787448000,932307584,77692296,114565672,29674946560,1,2700,2839903.04397021,33798394966.3867,893958728.422223,176189072,28665778176,748926336,0.0561260945410868,0.0367809301225509
AA0112,12,70015592,25960032,00000000000000000108,0,AA0112. New Britain-New Ireland montane rain forests,10010,New Britain-New Ireland Montane Rain Forests,"","","","",AA1,"Olson, 2001",Tropical and Subtropical Moist Broadleaf Forests,1,AA,Australasia,14242.225,267934.5,1347660.8,1032558.1,445960.69,14242.225,189599.94,1320080.6,870555.75,335582.5,1780.3826,8011.6787,672938.44,12474385,21470.826,60644408,65049920,11396581376,11331531776,11344006144,60637180,52575536,4381294.5,5420826.5,11270894592,1,2500,554420.231524459,12038907301.1558,64346024.9242494,10064976,11215412224,60618356,0.00624280147725402,0.0023146747958535
AA0113,13,0,0,0000000000000000010a,0,AA0113. New Caledonia rain forests,10011,New Caledonia Rain Forests,"","","","",AA1,"Olson, 2001",Tropical and Subtropical Moist Broadleaf Forests,1,AA,Australasia,10562500,199350496,695920704,632624256,325635488,10562500,84206376,713757824,378199808,141403888,665817.19,2177542.3,358759552,12359251,10295631,1162980480,66564932,9243108352,9176543232,9188902912,1163247360,54205680,4517140,5547077.5,8013295616,1,3000,277548.299133221,12390126071.9383,1584339792.55402,6271844.5,9130215424,1226593152,0,0
AA0114,14,0,0,0000000000000000010c,0,AA0114. Norfolk Island subtropical forests,10012,Norfolk Island Subtropical Forests,"","","","",AA1,"Olson, 2001",Tropical and Subtropical Moist Broadleaf Forests,1,AA,Australasia,0,0,0,0,0,0,0,0,0,0,0,0,0,0,0,0,0,0,0,0,0,0,0,0,0,1,165,0,0,0,0,0,0,,
AA0115,15,6490891776,4120358400,0000000000000000010e,0,AA0115. Northern New Guinea lowland rain and freshwater swamp forests,10013,Northern New Guinea Lowland Rain And Freshwater Swamp Forests,"","","","",AA1,"Olson, 2001",Tropical and Subtropical Moist Broadleaf Forests,1,AA,Australasia,5646542,85650400,487181792,358647872,146538224,5646542,52213876,470895232,300659584,106753624,1753769.3,11540872,346447264,335375008,44337824,14099696640,1664178816,115749142528,114084962304,114420342784,14061005824,1328803840,110733656,138681568,100023959552,1,4400,45730892.0524146,127731838264.131,15084491228.5229,192695104,112280633344,14030496768,0.0578095401021966,0.0366969643587264
AA0116,16,4646427136,1495139456,00000000000000000110,0,AA0116. Northern New Guinea montane rain forests,10014,Northern New Guinea Montane Rain Forests,"","","","",AA1,"Olson, 2001",Tropical and Subtropical Moist Broadleaf Forests,1,AA,Australasia,1852342,28566694,158221264,124852696,54504888,1852342,16230751,168478224,110991384,41152548,567135,3101820.8,104714344,32831294,11404648,3219670784,171688736,21984929792,21813241856,21846073344,3210118400,138857440,11571453,14307395,18603122688,1,3000,1170968.91072432,23027271579.4772,3373450243.10342,17483406,21670227968,3198413056,0.21441524024857,0.068995095861836
AA0117,17,15022883840,2132755200,0000000000000000003e,0,AA0117. Queensland tropical rain forests,10015,Queensland Tropical Rain Forests,"",4/3/2009,Yes/April2009/S.Sheppard,Updated,AA1,Australian Government via S.Sheppard,Tropical and Subtropical Moist Broadleaf Forests,1,AA,Australasia,5760174,110220472,371694336,335209248,179012784,5760174,82221320,392288160,290790208,137695424,1863958.5,11456480,238557264,19653002,99700360,9599596544,271186080,16782927872,16511741952,16531394560,9505656832,251533072,20961090,22598840,7006085120,1,4800,324567029.936314,31201079484.0859,14005700813.0607,26081528,16313460736,10780552192,0.920888834264823,0.130735914010784
AA0118,18,1966224128,916093824,00000000000000000112,0,AA0118. Seram rain forests,10016,Seram Rain Forests,"","","","",AA1,"Olson, 2001",Tropical and Subtropical Moist Broadleaf Forests,1,AA,Australasia,3883518.8,66583792,323269600,260104080,116433592,3883518.8,44321372,338734464,224466864,86068848,1035437.3,4591336,176630240,78861184,11572783,1865662592,406214048,16959123456,16552909824,16631770112,1857973376,327352864,27279406,33851172,14694936576,1,2100,1820701.43276016,18150832538.579,1975153237.67667,55200792,15965509632,1847416320,0.123154485720835,0.057379554121082
AA0119,19,1204126848,754563520,00000000000000000114,0,AA0119. Solomon Islands rain forests,10017,Solomon Islands Rain Forests,"","","","",AA1,"Olson, 2001",Tropical and Subtropical Moist Broadleaf Forests,1,AA,Australasia,9953039,1424222848,1387116800,1191522688,762710784,9953039,95086944,918966848,491939712,182957280,1038787.6,8768312,60546340,159321904,4658584,303064000,848690880,31115081728,30266390528,30425712640,308358464,689368960,57447412,70724240,29958031360,1,4800,915261.109339895,33049984856.2067,291768571.645703,104144408,29240481792,293650016,0.0411801302237585,0.0258054407368364
AA0120,20,2723553280,1061492032,00000000000000000116,0,AA0120. Southeastern Papuan rain forests,10018,Southeastern Papuan Rain Forests,"","","","",AA1,"Olson, 2001",Tropical and Subtropical Moist Broadleaf Forests,1,AA,Australasia,1299042.4,18336376,121376480,90165024,36330316,1299042.4,15780125,119195928,80589912,30459978,173674.73,771598.38,68501728,211872624,2950869.5,344005152,949187520,65557098496,64607911936,64819781632,342353312,737314880,61442908,79098960,64265560064,1,5500,5346265.31321998,73162910738.0435,2510361226.89578,97675856,63798931456,2280392192,0.0426896378645204,0.0166380848044779
AA0121,21,2163705088,1454230784,00000000000000000118,0,AA0121. Southern New Guinea freshwater swamp forests,10019,Southern New Guinea Freshwater Swamp Forests,"","","","",AA1,"Olson, 2001",Tropical and Subtropical Moist Broadleaf Forests,1,AA,Australasia,10867953,177434432,845932352,698483136,304273888,10867953,119852624,834168576,544784640,205377648,1471035.4,5577438,467081536,113342696,42517048,4726149120,621151936,77516996608,76895846400,77009190912,4694499840,507809248,42317436,51762660,72201347072,1,2100,69158551.0543071,89164386704.6011,6607941458.39275,102117592,75678883840,4643947008,0.0285906051756061,0.0192158064470735
AA0122,22,11366161408,6264952832,0000000000000000011a,0,AA0122. Southern New Guinea lowland rain forests,10020,Southern New Guinea Lowland Rain Forests,"","","","",AA1,"Olson, 2001",Tropical and Subtropical Moist Broadleaf Forests,1,AA,Australasia,6777326,98466128,582256768,466402528,192118896,6777326,56376840,533553568,343278848,120221576,397413.34,1830188.5,431725952,192523648,11382529,5759267840,1061716544,112001105920,110939389952,111131910144,5754662400,869192896,72432744,88476376,105184731136,1,4000,47164641.6525844,119533292356.331,6016209073.9328,152453792,109256941568,5738369536,0.104031480699337,0.0573414626300955
AA0123,23,99065118720,22992041984,0000000000000000011c,0,AA0123. Sulawesi lowland rain forests,10021,Sulawesi Lowland Rain Forests,"","","","",AA1,"Olson, 2001",Tropical and Subtropical Moist Broadleaf Forests,1,AA,Australasia,78147608,1017500992,6855921664,4967808512,2049104000,78147608,853444096,7165718016,4830226944,1834305024,41499752,173289600,4983799808,1473504128,236722560,6180985856,7070202368,79082020864,72011816960,73485320192,6022410752,5596698112,466391520,589183552,65989406720,1,3900,61425665.1155835,95011934102.7783,6797791536.38303,694919936,66573463552,5898256384,1.48805715422364,0.345363464018078
AA0124,24,9431773184,3330542080,0000000000000000011e,0,AA0124. Sulawesi montane rain forests,10022,Sulawesi Montane Rain Forests,"","","","",AA1,"Olson, 2001",Tropical and Subtropical Moist Broadleaf Forests,1,AA,Australasia,39611344,528652864,3398330112,2490292480,1051942080,39611344,449294784,3656185856,2465208320,957526592,19630774,82196704,2493953280,322834368,157790336,9887935488,1788060800,64490827776,62702768128,63025602560,9769756672,1465226496,122102208,149005072,52933009408,1,2200,6836840.92210925,73012139432.8985,10666063849.5651,208094384,60745129984,9606930432,0.155267972699775,0.0548281332326929
AA0125,25,336245696,157755552,00000000000000000120,0,AA0125. Trobriand Islands rain forests,10023,Trobriand Islands Rain Forests,"","","","",AA1,"Olson, 2001",Tropical and Subtropical Moist Broadleaf Forests,1,AA,Australasia,1253730,19417624,122052032,90431272,39046076,1253730,13296406,120087384,78893944,30622038,344932.38,1664620.6,59919044,29573844,2102753.8,220894496,101652504,3237871104,3136218624,3165792512,220045472,72078656,6006554.5,8471042,2916173056,1,2800,418399.532643357,3592914240.30665,252619048.986604,14162100,2982953216,217209632,0.112722416897604,0.052885694336012
AA0126,26,622625920,406737984,00000000000000000122,0,AA0126. Vanuatu rain forests,10024,Vanuatu Rain Forests,"","","","",AA1,"Olson, 2001",Tropical and Subtropical Moist Broadleaf Forests,1,AA,Australasia,509287.81,10032670,43996160,33658492,15649352,509287.81,4267204.5,34658472,20499016,8068432,5124.0723,19645.316,15834111,4359985.5,664094.06,389309792,35806484,10081203200,10045396992,10049757184,389154976,31446498,2620541.5,2983873.8,9656242176,1,950,1517241.74596354,10643445640.6039,429257071.05013,5295531,9985883136,387715360,0.0623506115103008,0.0407312982197512
AA0127,27,2310048256,1259135616,00000000000000000124,0,AA0127. Vogelkop montane rain forests,10025,Vogelkop Montane Rain Forests,"","","","",AA1,"Olson, 2001",Tropical and Subtropical Moist Broadleaf Forests,1,AA,Australasia,8114551,96969376,745367104,523697280,208440848,8114551,76442912,719390912,477634272,179580992,3569750.8,21646404,564599296,34349032,38319264,10291000320,154278864,20174372864,20020094976,20054444032,10260795392,119929832,9994153,12856572,9759299584,1,5500,968553.739014629,21244478965.6074,10793715145.9901,16034597,19885750272,10239143936,0.116166009549695,0.0633184867946832
AA0128,28,11943806976,6724760576,00000000000000000126,0,AA0128. Vogelkop-Aru lowland rain forests,10026,Vogelkop-Aru Lowland Rain Forests,"","","","",AA1,"Olson, 2001",Tropical and Subtropical Moist Broadleaf Forests,1,AA,Australasia,14726015,157639680,1307359232,897292096,348355360,14726015,121879584,1321881600,826416640,294823584,6799793.5,28984412,1069010688,219811920,38604168,6243025408,1026830592,69196759040,68169928704,68389740544,6219147264,807018688,67251560,85569216,61950779392,1,3500,8526540.5937417,72074279066.0418,6340258782.2327,122780888,66986704896,6153586176,0.178301156842142,0.100389481561162
AA0201,1,25736335360,3554974720,00000000000000000128,0,AA0201. Lesser Sundas deciduous forests,10027,Lesser Sundas Deciduous Forests,"","","","",AA2,"Olson, 2001",Tropical and Subtropical Dry Broadleaf Forests,2,AA,Australasia,7017430.5,105809696,571486272,475183744,233615696,7017430.5,75829248,622543616,420597760,176633904,1266300.3,4298494,349408928,78053240,26168834,1573367936,507208800,20488849408,19981639680,20059693056,1554216576,429155552,35762964,42267400,18427422720,2,2500,8156453.70346073,31381214897.1411,2025906166.57547,48926316,19608176640,1535783936,1.31253077899649,0.181300627042903
AA0202,2,0,0,0000000000000000012a,0,AA0202. New Caledonia dry forests,10028,New Caledonia Dry Forests,"","","","",AA2,"Olson, 2001",Tropical and Subtropical Dry Broadleaf Forests,2,AA,Australasia,7072257,163514912,483994528,508684928,262560336,7072257,93197632,488102880,365083104,162631648,271263.34,1243153.1,141617248,3591155,4968928.5,363685408,16487592,1181041280,1164553728,1168144896,365788736,12896437,1074703.1,1373966,798764992,2,430,172351.623223039,2662752700.5841,795006604.125191,1718484.8,1150108544,355719040,0,0
AA0203,3,1904628992,353202784,0000000000000000012c,0,AA0203. Sumba deciduous forests,10029,Sumba Deciduous Forests,"","","","",AA2,"Olson, 2001",Tropical and Subtropical Dry Broadleaf Forests,2,AA,Australasia,2294056.5,40454676,186915904,169822224,83425960,2294056.5,29105722,194144736,151606608,65428380,113594.95,472021.91,77247392,12997329,2704902,683114816,68315456,3048437504,2980122112,2993119488,682704000,55318128,4609844,5692954.5,2297418240,2,900,78899.2106170854,6399974587.80579,914333304.451594,6888035,2924452864,677140288,0.651277035593896,0.120775680247039
AA0204,4,7086775296,1222783488,0000000000000000012e,0,AA0204. Timor and Wetar deciduous forests,10030,Timor And Wetar Deciduous Forests,"","","","",AA2,"Olson, 2001",Tropical and Subtropical Dry Broadleaf Forests,2,AA,Australasia,17524748,280430944,1454530048,1191506176,561611776,17524748,196439920,1482427904,1045690432,426834496,3176526.8,12395686,815247232,54948984,47757660,1823611008,362819072,12519431168,12156612608,12211561472,1793378048,307870080,25655840,30234922,10363234304,2,1600,411227.72859541,27623714324.2862,3004389687.21623,32157710,11940592640,2006152576,0.593502810929157,0.102405594501547
AA0401,1,0,0,00000000000000000130,0,AA0401. Chatham Island temperate forests,10031,Chatham Island Temperate Forests,"","","","",AA4,"Olson, 2001",Temperate Broadleaf and Mixed Forests,4,AA,Australasia,0,0,0,0,0,0,0,0,0,0,0,0,0,0,0,0,0,0,0,0,0,0,0,0,0,4,315,2987736.51592116,406314612.99228,31503236.9108475,0,0,0,,
AA0402,2,396981207040,43393310720,0000000000000000003f,0,AA0402. Eastern Australian temperate forests,10032,Eastern Australian Temperate Forests,"",4/3/2009,Yes/April2009/S.Sheppard,Updated,AA4,Australian Government via S.Sheppard,Temperate Broadleaf and Mixed Forests,4,AA,Australasia,354466912,7250736640,22926299136,21013614592,10927352832,354466912,4213738240,22915540992,14654520320,6360218624,156868768,589994688,16317670400,361270784,439935328,25352228864,1513813504,71522721792,70008905728,70370181120,25266759680,1152542720,96045224,126151128,44742148096,4,3700,163650575.260572,159135390241.515,45041829065.3011,206333152,67808722944,28448747520,5.85442683189666,0.639936999784474
AA0403,3,33512364,2764963,00000000000000000132,0,AA0403. Fiordland temperate forests,10033,Fiordland Temperate Forests,"","","","",AA4,"Olson, 2001",Temperate Broadleaf and Mixed Forests,4,AA,Australasia,4553470,110709720,289401344,285641536,158096400,4553470,70200512,268308752,187098192,89617520,1001383.1,3642529,141622912,1770428.1,24300988,6538986496,25094794,6552348672,6527254016,6529024512,6519239168,23324366,1943697.1,2091232.9,8014848,4,750,762313.830728209,6790980276.71547,6771959317.15335,1723681.1,6521322496,6509246976,0.00513889077262404,0.000423988079365183
AA0404,4,656127360,270612128,00000000000000000134,0,AA0404. Nelson Coast temperate forests,10034,Nelson Coast Temperate Forests,"","","","",AA4,"Olson, 2001",Temperate Broadleaf and Mixed Forests,4,AA,Australasia,4695737.5,111545760,271993760,253377392,140770464,4695737.5,50071588,282470176,172982736,70768384,1135919,4230081.5,179768128,75324416,14318583,9421870080,191825136,10955475968,10763651072,10838975488,9412247552,116500720,9708393,15985428,1351403520,4,1300,1926640.93534358,12704582888.8077,10527949890.115,19120058,10611314688,9354460160,0.0618328057636434,0.0255022243667909
AA0405,5,41825206272,5673354240,00000000000000000136,0,AA0405. North Island temperate forests,10035,North Island Temperate Forests,"","","","",AA4,"Olson, 2001",Temperate Broadleaf and Mixed Forests,4,AA,Australasia,26679818,453090752,1642353408,1349921920,676428160,26679818,243982992,1758990464,988823552,397893568,9486169,31045620,1335729024,1727128576,57007400,11817476096,3311380480,35369992192,32058611712,33785741312,11787148288,1584251904,132020992,275948384,20271464448,4,1200,19806584.914538,44648129837.3395,15205786544.7235,305463328,29871652864,13383387136,1.40016377608639,0.189924349544021
AA0406,6,58167582720,5504870912,00000000000000000138,0,AA0406. Northland temperate kauri forests,10036,Northland Temperate Kauri Forests,"","","","",AA4,"Olson, 2001",Temperate Broadleaf and Mixed Forests,4,AA,Australasia,13894833,264485440,860097856,755202688,390587648,13894833,110525200,887089024,467204992,181406688,4119411.8,14606180,643726976,438448096,14567604,2574366720,841538496,9628387328,8786848768,9225296896,2573693952,403090400,33590868,70128208,6213154816,4,850,2970551.09952289,13624358992.6962,3051009903.98959,85800616,8083976192,2648857088,7.19541737116487,0.680960802117117
AA0407,7,8235739.5,3112968.3,0000000000000000013a,0,AA0407. Rakiura Island temperate forests,10037,Rakiura Island Temperate Forests,"","","","",AA4,"Olson, 2001",Temperate Broadleaf and Mixed Forests,4,AA,Australasia,55649.449,1417365.1,3093943.5,3357096,2095501.4,55649.449,702157,2800418.8,1995188.5,944873.69,8610.7461,36260.66,1880929.5,17669.957,378694.47,1096220160,441820.41,1178171136,1177729280,1177746944,1095897088,424150.44,35345.871,36818.367,81832192,4,570,779.686116536458,1335292837.15128,1235091989.77431,30365.639,1177624576,1095634176,0.00699351870523463,0.00264343014186552
AA0408,8,4262272000,609614080,0000000000000000013c,0,AA0408. Richmond temperate forests,10038,Richmond Temperate Forests,"","","","",AA4,"Olson, 2001",Temperate Broadleaf and Mixed Forests,4,AA,Australasia,11085495,259547328,653612864,678045824,392067744,11085495,101671208,721241408,403159040,182883104,1307113.9,5554919,347692192,339276352,12745357,3471687424,564746688,6412856320,5848109568,6187385856,3470027520,225470336,18789194,47062224,2378082048,4,1000,1465945.01598148,8119956957.90106,3976089247.84534,50278504,5507843072,3454017792,0.773855018068314,0.11068109095175
AA0409,9,218704412672,12643296256,00000000000000000040,0,AA0409. Southeast Australia temperate forests,10040,Southeast Australia Temperate Forests,"",4/3/2009,Yes/April2009/S.Sheppard,Updated,AA4,Australian Government via S.Sheppard,Temperate Broadleaf and Mixed Forests,4,AA,Australasia,83271392,1269775744,4793580544,4238203648,2257626368,83271392,1026555648,4825330688,3579361024,1728296832,22497558,116913208,4434935808,1284439552,290568224,19153268736,3532108544,63353745408,59821637632,61106077696,18945972224,2247668992,187305744,294342368,40875663360,4,2400,59318726.3974357,110862925561.979,31686267046.5417,353263936,56994996224,21499670528,3.83725637619932,0.221831688632976
AA0410,10,2003686400,123177400,0000000000000000013e,0,AA0410. South Island temperate forests,10039,South Island Temperate Forests,"","","","",AA4,"Olson, 2001",Temperate Broadleaf and Mixed Forests,4,AA,Australasia,6521644,131498392,397255264,370980544,184725040,6521644,52778860,434451392,211434176,78760040,2005598.3,7221905,274691520,112584712,5864679.5,1782855680,218529968,3374229248,3155699200,3268283904,1783512704,105945256,8828771,18210830,1372186496,4,650,7955944.88946015,4042689047.78259,2001143590.91322,19913262,3015790592,1773458048,0.664398385390281,0.0408441489030284
AA0411,11,3379636480,284070112,00000000000000000041,0,AA0411. Tasmanian Central Highland forests,10041,Tasmanian Central Highland Forests,"",4/3/2009,Yes/April2009/S.Sheppard,Updated,AA4,Australian Government via S.Sheppard,Temperate Broadleaf and Mixed Forests,4,AA,Australasia,2582755.5,57856144,140553472,162225440,93087136,2582755.5,32237894,136769072,101542696,45791568,362982.84,1541990,88656376,66260524,11152453,3564973056,209165392,5711377920,5502212608,5568473088,3556403456,142904864,11908739,17430450,1945809152,4,700,6358796.84860537,6947588269.40713,3777021941.68085,22564426,5305218048,3561569792,0.637040070628969,0.0535454168763319
